{
  "schema_version": "1.0.0",
  "status": "awaiting_configuration",
  "source": "cloudflare_web_analytics",
  "period_start": null,
  "generated_at": null,
  "visits": null,
  "page_views": null,
  "countries": [],
  "referrers": [],
  "privacy_note_es": "Sólo se publicarán países y sitios referentes con al menos cinco visitas; nunca direcciones IP ni recorridos individuales.",
  "privacy_note_en": "Countries and referring sites will be published only after at least five visits; never IP addresses or individual browsing histories."
}
